PROGRAMNAME	PROGRAMURL	CATALOGNAME	LASTUPDATED	NAME	KEYWORDS	DESCRIPTION	SKU	MANUFACTURER	MANUFACTURERID	UPC	ISBN	CURRENCY	SALEPRICE	PRICE	RETAILPRICE	FROMPRICE	BUYURL	IMPRESSIONURL	IMAGEURL	ADVERTISERCATEGORY	THIRDPARTYID	THIRDPARTYCATEGORY	AUTHOR	ARTIST	TITLE	PUBLISHER	LABEL	FORMAT	SPECIAL	GIFT	PROMOTIONALTEXT	STARTDATE	ENDDATE	OFFLINE	ONLINE	INSTOCK	CONDITION	WARRANTY	STANDARDSHIPPINGCOST
DHGate	http://www.dhgate.com/	Portuguese Product Catalog	2016-06-16 00:55:31.98	NEW Maquiagem HOT Lime Crime VELVETINES Lip Gloss o líquido batom matte 10 cores de transporte DHL grátis		Shenzhen alina Co.Ltd é especializada em Eletrônica Cliente. Com 5 anos # 039; experiência no serviço aduaneiro, Nossos produtos são principalmente cigarros E, filmes em DVD beleza saudável e bate fones de ouvido ...	266198317					USD		14.7			http://www.tkqlhce.com/click-7893798-12274193?url=http%3A%2F%2Fpt.dhgate.com%2Fproduct%2Fhot-new-makeup-lime-crime-velvetines-lip%2F266198317.html	http://www.tqlkg.com/image-7893798-12274193	http://image.dhgate.com/600x600/f2/albu/g2/M01/67/C5/rBVaGlZB6RKAXaGrAAEgHRjRFSw620.jpg	BrilhodeLábios																yes			
DHGate	http://www.dhgate.com/	Portuguese Product Catalog	2016-06-16 00:55:31.98	Anti-estático de bateria adesivo Tiras etiqueta fita cola de etiqueta vermelha para Apple iPhone 5 5S 5C 4 4S Pull remoção de marca de Batterie As peças de reposição		Compatível: Para iphone	216203491					USD		15.5			http://www.anrdoezrs.net/click-7893798-12274193?url=http%3A%2F%2Fpt.dhgate.com%2Fproduct%2Fanti-static-battery-adhesive-strips-sticker%2F216203491.html	http://www.tqlkg.com/image-7893798-12274193	http://image.dhgate.com/600x600/f2/albu/g3/M00/34/14/rBVaHVSiZnOAI_r3AABggvlSJQE508.jpg	OutrasPeçasparaCelular																yes			
DHGate	http://www.dhgate.com/	Portuguese Product Catalog	2016-06-16 00:55:31.981	10 Sheet / lot prego Beleza natural Flor colorido DIY Nail Art poloneses folhas de decalque Dicas Wraps decoração de água Transferências [JC03039 * 10]		1) Tipo: etiquetas do prego 2) Material: etiquetas de papel 3) Tamanho: Pls ver a descrição 4) O pacote inclui: 10 folhas embalar prego etiqueta de transferência de água, envie aleatoriamente	204672284					USD		5.24			http://www.anrdoezrs.net/click-7893798-12274193?url=http%3A%2F%2Fpt.dhgate.com%2Fproduct%2F10-sheet-lot-nail-beauty-nature-colorful%2F204672284.html	http://www.tqlkg.com/image-7893798-12274193	http://image.dhgate.com/albu_863899689_00/1.600x600.jpg	EtiqueseDecalques																yes			
DHGate	http://www.dhgate.com/	Portuguese Product Catalog	2016-06-16 00:55:31.981	2015 4 estilos Microtech A07 Preto Individual lâmina 3300 faca facas BM42 BM43 BK32 sobrevivência camping com saco de nylon		Queridos coustomers, se você precisar de fotos mais detalhes sobre o item, pode contactar-nos em sua conveniência via e-mail ou chat online	229184843					USD		34.97			http://www.jdoqocy.com/click-7893798-12274193?url=http%3A%2F%2Fpt.dhgate.com%2Fproduct%2F2015-4-styles-microtech-a07-black-single%2F229184843.html	http://www.tqlkg.com/image-7893798-12274193	http://image.dhgate.com/600x600/f2/albu/g3/M01/71/2D/rBVaHFWSSlWAbvKiAAHzoaF1yBE350.jpg	FacaseFerramentas																yes			
DHGate	http://www.dhgate.com/	Portuguese Product Catalog	2016-06-16 00:55:31.981	Hot! 2015 New Darsonval Wand 4 em 1 High Frequency removedor Facial Skin Care Facial Spa Salon Beauty Therapy Acne Dispositivo		Pacote inclui: 1 x Hand Piece 4 x tubo de vidro	238722045					USD		30.74			http://www.jdoqocy.com/click-7893798-12274193?url=http%3A%2F%2Fpt.dhgate.com%2Fproduct%2Fhot-2015-new-darsonval-wand-4-in-1-high-frequency%2F238722045.html	http://www.tqlkg.com/image-7893798-12274193	http://image.dhgate.com/600x600/f2/albu/g1/M00/BC/E5/rBVaGVVMiDeAVPANAAYw3qKQvNM503.jpg	Aparelhosdecuidadoscomapeleaodomicílio																yes			
DHGate	http://www.dhgate.com/	Portuguese Product Catalog	2016-06-16 00:55:31.982	Atacado-1 Parte Permanente Padrão tatuagem Munsu Makeup livro para sobrancelha e lábios Maquiagem frete grátis		Tatuagem barata dos acessórios à venda a preço de banana, Compro Qualidade espada livro, livro de design ferramenta, ferramenta elétrica a partir de espada livro Fornecedores China em Aliexpress.com:1,Material:Paper 2, Origem Local: China 3, quantidade: 1 4, Número de modelo : T0837 5, Estado: Novo	374358130					USD		16.12			http://www.dpbolvw.net/click-7893798-12274193?url=http%3A%2F%2Fpt.dhgate.com%2Fproduct%2Fwholesale-1-piece-permanent-standard-tattoo%2F374358130.html	http://www.tqlkg.com/image-7893798-12274193	http://image.dhgate.com/600x600/f2/albu/g2/M00/B2/C0/rBVaGlbLq9eAcSJ_AADcrrM-WFQ532.jpg	OutrosMateriaisdeTatuagem																yes			
DHGate	http://www.dhgate.com/	Portuguese Product Catalog	2016-06-16 00:55:31.982	2pcs Pro maquiagem jogo de escova cosmético compo a caixa de couro Cup suporte da ferramenta + kits frete grátis venda quente		12pcs Pro maquiagem cosméticos Brush Set Make up couro Cup suporte da ferramenta + kits de caso	208317462					USD		75.45			http://www.anrdoezrs.net/click-7893798-12274193?url=http%3A%2F%2Fpt.dhgate.com%2Fproduct%2F2pcs-pro-cosmetic-makeup-brush-set-make-up%2F208317462.html	http://www.tqlkg.com/image-7893798-12274193	http://image.dhgate.com/albu_902245374_00/1.600x600.jpg	Pincéisdemaquiagem																yes			
DHGate	http://www.dhgate.com/	Portuguese Product Catalog	2016-06-16 00:55:31.982	2016 Soccer Jersey Atletico Nacional Medellin Maillot de pé 2017 Ibarbo Diego Arias Cardenas Luis Carlos Início camisas do futebol da qualidade superior		2016 Soccer Jersey Atletico Nacional Medellin Maillot de pé 2017 Ibarbo Diego Arias Cardenas Luis Carlos Início camisas do futebol da qualidade superior .home verdes e distância camisas de futebol negro .best tailândia qualidade A +++, com a impressão original, com o logotipo bordado! Os preços no atacado! tamanho dos EUA: s m l xl qualquer equipe de Futebol Na loja!	379037836					USD		15.08			http://www.kqzyfj.com/click-7893798-12274193?url=http%3A%2F%2Fpt.dhgate.com%2Fproduct%2F2016-soccer-jersey-atletico-nacional-medellin%2F379037836.html	http://www.tqlkg.com/image-7893798-12274193	http://image.dhgate.com/600x600/f2/albu/g4/M01/8C/33/rBVaEVcLLeqAXX8LAAF2sFhHYHM987.jpg	Jerseysdefutebol																yes			
DHGate	http://www.dhgate.com/	Portuguese Product Catalog	2016-06-16 00:55:31.983	BNWT Dot Cute Mouse Tops Calças camisa saia Outfits Roupa definir Baby Kids Girls 2 ~ 6Y		BNWT Dot Cute Mouse Tops Calças camisa saia Outfits Roupa definir Baby Kids Girls 2 ~ 6Y	259325119					USD		15.09			http://www.dpbolvw.net/click-7893798-12274193?url=http%3A%2F%2Fpt.dhgate.com%2Fproduct%2Fbnwt-dot-cute-mouse-tops-shirt-skirt-pants%2F259325119.html	http://www.tqlkg.com/image-7893798-12274193	http://image.dhgate.com/600x600/f2/albu/g3/M00/C2/EF/rBVaHFYbg1aAY8stAAJqC5UXJqE341.jpg	Roupasemoda deCriança																yes			
DHGate	http://www.dhgate.com/	Portuguese Product Catalog	2016-06-16 00:55:31.983	540 agulhas Derma Micro rolos de agulhas Pele Dermatologia Terapia Microneedle Dermaroller		Cores opcionais: roxo, branco, azul comprimento da agulha: 0,5 / 1,0 / 1,5 / 2,0 / 2,5 / 3,0 milímetros Cor Handle opcional: Números de agulhas negras: 540 Área de tratamento: para o rosto	200691258					USD		5.6			http://www.tkqlhce.com/click-7893798-12274193?url=http%3A%2F%2Fpt.dhgate.com%2Fproduct%2F540-needles-derma-micro-needle-skin-roller%2F200691258.html	http://www.tqlkg.com/image-7893798-12274193	http://image.dhgate.com/albu_822143793_00/1.600x600.jpg	Micro-agulharolo																yes			
DHGate	http://www.dhgate.com/	Portuguese Product Catalog	2016-06-16 00:55:31.983	mini câmera escondida do espião câmera de vídeo wi-fi P2P Camera ID DIY Módulo Mini DV DVR sem fio Spy Surveillance		color: zise preta: tamanho mini (56 milímetros * 22 milímetros * 20 milímetros PACOTE: yes Suporte a Alta Definição: 640 * 480p	375111988					USD		33.14			http://www.anrdoezrs.net/click-7893798-12274193?url=http%3A%2F%2Fpt.dhgate.com%2Fproduct%2Fmini-camera-spy-hidden-camera-video-wifi%2F375111988.html	http://www.tqlkg.com/image-7893798-12274193	http://image.dhgate.com/600x600/f2/albu/g3/M00/94/23/rBVaHFbX5-yAMi_tAAVl7vQ8NM4918.jpg	MiniDVsdeEspionagem																yes			
DHGate	http://www.dhgate.com/	Portuguese Product Catalog	2016-06-16 00:55:31.983	MXR Smart PC TV Box RK3229 Com 1G 8G WiFi Kodi 4K HD S805 Quad Core Android 5.1		Pacote Acessórios: 1 X MXR TV Box 1 x Power Adapter 1 X cabo HDMI 1 X IR Controle Remoto 1 x cabos AV 1 x Manual do Usuário	382639457					USD		29.5			http://www.tkqlhce.com/click-7893798-12274193?url=http%3A%2F%2Fpt.dhgate.com%2Fproduct%2Fmxr-smart-pc-tv-box-rk3229-with-1g-8g-wifi%2F382639457.html	http://www.tqlkg.com/image-7893798-12274193	http://image.dhgate.com/600x600/f2/albu/g4/M01/C1/21/rBVaEFc-spaAZsbfAAwbzunf0fY542.jpg	TVBoxdeAndroid																yes			
DHGate	http://www.dhgate.com/	Portuguese Product Catalog	2016-06-16 00:55:31.984	Venda quente portátil mini teclado Keyboard Rii Mini i8 sem fio com touchpad para PC Pad Google Andriod TV Box frete grátis		Venda quente portátil mini teclado Keyboard Rii Mini i8 sem fio com touchpad para PC Pad Google Andriod TV Box frete grátis	232666645					USD		14.9			http://www.jdoqocy.com/click-7893798-12274193?url=http%3A%2F%2Fpt.dhgate.com%2Fproduct%2Fhot-selling-portable-mini-keyboard-rii-mini%2F232666645.html	http://www.tqlkg.com/image-7893798-12274193	http://image.dhgate.com/600x600/f2/albu/g3/M00/49/DD/rBVaHVUQ5sKAceyvAAJOXBN7Ems876.jpg	Teclados																yes			
DHGate	http://www.dhgate.com/	Portuguese Product Catalog	2016-06-16 00:55:31.984	18 centímetros articulações Batman O Joker móveis Action Comics PVC Figura DC The Dark Knight Rises colecionáveis ​​modelo de brinquedo armas Toys vs presentes superman		Nome do produto: Joker Figuras Condição: 100% Novo Tamanho: cerca de 18 centímetros de altura Peso: 120g Pacote: opp bag Material: PVC Categoria: Figura cor: como o estilo de imagem 4 pode escolher	378227679					USD		14.75			http://www.tkqlhce.com/click-7893798-12274193?url=http%3A%2F%2Fpt.dhgate.com%2Fproduct%2F18cm-batman-the-joker-movable-joints-pvc%2F378227679.html	http://www.tqlkg.com/image-7893798-12274193	http://image.dhgate.com/600x600/f2/albu/g4/M01/9F/40/rBVaEVcA2N2AJYM9AAFI-1rP33Y617.jpg																	yes			
DHGate	http://www.dhgate.com/	Portuguese Product Catalog	2016-06-16 00:55:31.984	24 pcs HOT nova maquiagem Retro Matte líquidos Lips Lip Gloss 12 cores de alta qualidade		NEW Maquiagem Retro Matte líquidos Lips Lip Gloss 12 Color..I vender um lote de produtos delineador, sombra, rímel, blush, gloss, escova, ......	381837181					USD		33			http://www.dpbolvw.net/click-7893798-12274193?url=http%3A%2F%2Fpt.dhgate.com%2Fproduct%2F24-pcs-hot-new-makeup-retro-matte-liquid%2F381837181.html	http://www.tqlkg.com/image-7893798-12274193	http://image.dhgate.com/600x600/f2/albu/g4/M01/EF/64/rBVaEVc4IJaAHHMOAACua0kpKg8694.jpg	BrilhodeLábios																yes			
DHGate	http://www.dhgate.com/	Portuguese Product Catalog	2016-06-16 00:55:31.985	Frete grátis! Recarregável de alta potência eletrônicos Auto Set Defesa		Recarregável de alta potência eletrônicos Auto Set Defesa	247859832					USD		15.18			http://www.dpbolvw.net/click-7893798-12274193?url=http%3A%2F%2Fpt.dhgate.com%2Fproduct%2Frechargeable-high-power-electronic-self-defense%2F247859832.html	http://www.tqlkg.com/image-7893798-12274193	http://image.dhgate.com/600x600/f2/albu/g2/M01/6C/08/rBVaG1WrtSWALuMZAArEuxXQorg520.jpg	Outro																yes			
DHGate	http://www.dhgate.com/	Portuguese Product Catalog	2016-06-16 00:55:31.985	2015 Hot Womens Bra Silicone Adhesive vara em Gel Push Up Bra Strapless Bras Backless Promocional desconta A2		bras baratos sutiã, comprar qualidade arte bra diretamente do sutiã de jóias Fornecedores China: 2 imprensa e 2picture, primeira alça não tem, 2º ter cinta. Nota: este produto posteriormente alterado para packi OPP	260680109					USD		7.24			http://www.kqzyfj.com/click-7893798-12274193?url=http%3A%2F%2Fpt.dhgate.com%2Fproduct%2F2015-hot-womens-bra-silicone-adhesive-stick%2F260680109.html	http://www.tqlkg.com/image-7893798-12274193	http://image.dhgate.com/600x600/f2/albu/g2/M00/D2/E1/rBVaGlYmNV-AIoLSAAAp_ZYBzEk964.jpg	Sutiãs																yes			
DHGate	http://www.dhgate.com/	Portuguese Product Catalog	2016-06-16 00:55:31.985	Marca de genebra Quartzo Analógico relógio de Pulso Para Homens / Mulheres Casual Esporte Relógio de Ouro Impermeável Relógio Masculino Genebra, três-olhos assista a 6 cores		De alta qualidade ; preço do Competidor ; o transporte Rápido; Queda de envio disponível;Melhor Oportuna e do Serviço;100% de Satisfação ; EXCELENTE QUALIDADE + ENVIO RÁPIDO + ENTUSIASTA de SERVIÇO = 100% de SATISFAÇÃO	242371950					USD		14.4			http://www.kqzyfj.com/click-7893798-12274193?url=http%3A%2F%2Fpt.dhgate.com%2Fproduct%2Fgeneva-brand-analog-quartz-wristwatch-for%2F242371950.html	http://www.tqlkg.com/image-7893798-12274193	http://image.dhgate.com/600x600/f2/albu/g2/M00/64/D4/rBVaGlVz9PiAeOaaAAQCkDV_lUc425.jpg	Relógiosde pulso																yes			
DHGate	http://www.dhgate.com/	Portuguese Product Catalog	2016-06-16 00:55:31.986	22 Packs Sea plataformas Sabiki pesca / ganchos iscas piscatore montados em terminais frete grátis		22 Packs Sea plataformas Sabiki pesca / ganchos iscas piscatore montados em terminais frete grátis	228830585					USD		24.29			http://www.kqzyfj.com/click-7893798-12274193?url=http%3A%2F%2Fpt.dhgate.com%2Fproduct%2F22-packs-sea-fishing-sabiki-rigs-piscatore%2F228830585.html	http://www.tqlkg.com/image-7893798-12274193	http://image.dhgate.com/600x600/f2/albu/g3/M00/E9/89/rBVaHVTIuTGAdcx5AAEfd4J2yU4823.jpg																	yes			
DHGate	http://www.dhgate.com/	Portuguese Product Catalog	2016-06-16 00:55:31.986	Bluetooth Car MP3 WMA Decoder Board 12V Módulo de áudio sem fio USB TF Radio		Bluetooth Car MP3 WMA Decoder Board 12V Módulo de áudio sem fio USB TF Radio	370886388					USD		15.04			http://www.tkqlhce.com/click-7893798-12274193?url=http%3A%2F%2Fpt.dhgate.com%2Fproduct%2Fcar-bluetooth-mp3-wma-decoder-board-12v-wireless%2F370886388.html	http://www.tqlkg.com/image-7893798-12274193	http://image.dhgate.com/600x600/f2/albu/g1/M01/C9/21/rBVaGFZ-VLaAQXJGAAKQU3irVqY293.jpg	MP3Players																yes			
DHGate	http://www.dhgate.com/	Portuguese Product Catalog	2016-06-16 00:55:31.986	Nova marca CE 5 cores OLED oxímetro de pulso da ponta do dedo - Spo2 Monitor de Home Care		New CEFDA 4 cores OLED Fingertip Oxímetro de Pulso - Spo2 do Monitor	150745439					USD		14.27			http://www.dpbolvw.net/click-7893798-12274193?url=http%3A%2F%2Fpt.dhgate.com%2Fproduct%2Fbrand-new-ce-5-colors-oled-fingertip-pulse%2F150745439.html	http://www.tqlkg.com/image-7893798-12274193	http://image.dhgate.com/albu_290002177_00/1.600x600.jpg	OxímetrodePulso																yes			
DHGate	http://www.dhgate.com/	Portuguese Product Catalog	2016-06-16 00:55:31.986	Nova composição Matte Lipstick Rouge Longa Duração ouro Batom Moda cores têm Inglês Nome Batom 3g (15 unidades / lote)		Esta qualidade muito boa Batom e belas cores, tem 20 cores diferentes todos têm Inglês Nome Batom 3G, você pode escolher você gosta de cores ou misturá-los.	242332566					USD		24.64			http://www.tkqlhce.com/click-7893798-12274193?url=http%3A%2F%2Fpt.dhgate.com%2Fproduct%2Fnew-makeup-matte-lipstick-rouge-long-lasting%2F242332566.html	http://www.tqlkg.com/image-7893798-12274193	http://image.dhgate.com/600x600/f2/albu/g1/M01/3B/A9/rBVaGVVy-BqACG5iAAEx8UTLsRE002.jpg	Batom																yes			
DHGate	http://www.dhgate.com/	Portuguese Product Catalog	2016-06-16 00:55:31.987	F 91 W relógio de desporto Relógios F-91 W correia de aço fino, eletrônicos assistir f91w A159w relógios		2012 Novos Homens/mulheres mesa Metálica de ouro e prata F-91W relógios f91 moda-fino LED alterar photoelectron relógios relógio do esporte	144341292					USD		28.23			http://www.dpbolvw.net/click-7893798-12274193?url=http%3A%2F%2Fpt.dhgate.com%2Fproduct%2Ff-91-w-sports-watch-watches-f-91-w-steel%2F144341292.html	http://www.tqlkg.com/image-7893798-12274193	http://image.dhgate.com/albu_781115185_00/1.600x600.jpg	Relógiosde pulso																yes			
DHGate	http://www.dhgate.com/	Portuguese Product Catalog	2016-06-16 00:55:31.987	maquiagem Hot 36H Pen Liner delineador à prova d'água longa maquiagem dos olhos duradouro envio GRATIS Cosmetic		504pcs selliing maquiagem quentes / lot 36H Pen Liner delineador à prova d'água dos olhos de longa duração maquiagem cosméticos	373420083					USD		28.44			http://www.jdoqocy.com/click-7893798-12274193?url=http%3A%2F%2Fpt.dhgate.com%2Fproduct%2Fhot-makeup-36h-pen-liner-waterproof-eyeliner%2F373420083.html	http://www.tqlkg.com/image-7893798-12274193	http://image.dhgate.com/600x600/f2/albu/g3/M00/68/BF/rBVaHVarFfqABF5oAAWlXpo-AS8317.jpg	Delineador																yes			
DHGate	http://www.dhgate.com/	Portuguese Product Catalog	2016-06-16 00:55:31.987	Hot Sale frete grátis 2016 Sexy Monokini brasileira swimsuit swimwear Mulheres One Piece Atacado Bodysuit Swim maiô Roupa Hong Kong		Cor: rosa Floral Vintage, Tamanho: S, M, L, modelo de vendas: misturar a ordem Material: 85% Nylon, 15% Spandex Quantidade: 1 itens por lote Express: ePacket, CPAM, DHL Quantidade: 10 itens por lote	376896280					USD		14.39			http://www.kqzyfj.com/click-7893798-12274193?url=http%3A%2F%2Fpt.dhgate.com%2Fproduct%2F2016-new-print-women-high-waist-swimwear%2F376896280.html	http://www.tqlkg.com/image-7893798-12274193	http://image.dhgate.com/600x600/f2/albu/g4/M00/FC/B9/rBVaEVbv8JKAQa00AAJR-dRBlU0817.jpg	Maiôs																yes			
DHGate	http://www.dhgate.com/	Portuguese Product Catalog	2016-06-16 00:55:31.988	qualidade Thai Wales 2016 de futebol jersey BALE casa RAMSEY vermelho afastado preto ALLEN TAYLOR WARD Wales camisa de futebol jersey		Wales Jersey camisa de futebol em casa e fora AAA futebol thai qualidade usa .Quality: melhor qualidade Tamanho thai: tamanho US maneira S M L Trade XL: Misture a ordem por atacado e venda	376484101					USD		13.95			http://www.tkqlhce.com/click-7893798-12274193?url=http%3A%2F%2Fpt.dhgate.com%2Fproduct%2Fthai-quality-wales-2016-soccer-jersey-bale%2F376484101.html	http://www.tqlkg.com/image-7893798-12274193	http://image.dhgate.com/600x600/f2/albu/g1/M01/0B/40/rBVaGFbqyryAaudmAAPit-fezc0365.jpg	Jerseysdefutebol																yes			
DHGate	http://www.dhgate.com/	Portuguese Product Catalog	2016-06-16 00:55:31.988	DHL frete grátis melhores novos Casa do Real Madrid 16-17 jerseys, o Real Madrid 2016 2017 campeões da liga camisas do esporte casa ao ar livre Camisa branca		ordem mista 1.can, personalizar livre de qualquer nome e número. 2.We oferecer as melhores camisas de qualidade tailandeses e os preços mais competitivos. 3.Free transporte DHL EMS China Post ePacket Outro álbum equipe roupas esportivas foto http://v.yupoo.com/photos/chenjia168/collections/	386099846					USD		14.09			http://www.dpbolvw.net/click-7893798-12274193?url=http%3A%2F%2Fpt.dhgate.com%2Fproduct%2Fdhl-top-new-real-madrid-home-16-17-jerseys%2F386099846.html	http://www.tqlkg.com/image-7893798-12274193	http://image.dhgate.com/600x600/f2/albu/g4/M01/2C/D5/rBVaEVdUZLmAZcNIAAC95FvmGbI652.jpg	Camisas decorrida																yes			
DHGate	http://www.dhgate.com/	Portuguese Product Catalog	2016-06-16 00:55:31.988	DHL transporte livre novo topo real madrid Longe 16/17 jerseys, o Real Madrid 2016-2017 champions league camisas do esporte Longe externas camisa roxa		ordem mista 1.can, personalizar livre de qualquer nome e número. 2.We oferecer as melhores camisas de qualidade tailandeses e os preços mais competitivos. 3.Free transporte DHL EMS China Post ePacket Outro álbum equipe roupas esportivas foto http://v.yupoo.com/photos/chenjia168/collections/	386099675					USD		14.09			http://www.dpbolvw.net/click-7893798-12274193?url=http%3A%2F%2Fpt.dhgate.com%2Fproduct%2Fdhl-top-new-real-madrid-away-16-17-jerseys%2F386099675.html	http://www.tqlkg.com/image-7893798-12274193	http://image.dhgate.com/600x600/f2/albu/g4/M00/F3/AD/rBVaEFdUZ1mAKkwjAABSr38wnvE437.jpg	Camisas decorrida																yes			
DHGate	http://www.dhgate.com/	Portuguese Product Catalog	2016-06-16 00:55:31.989	128/64 / 32 / 16GB class10 EVO + Plus cartão UHS-1 Cartão de Memória TF o Flash MicroSDHC para telefones Samsung Galaxy Xiaomi Huawei Android 5Pcs		128/64 / 32 / 16GB class10 EVO + Plus cartão UHS-1 Cartão de Memória TF o Flash MicroSDHC para telefones Samsung Galaxy Xiaomi Huawei Lenovo Android	380563055					USD		22.4			http://www.kqzyfj.com/click-7893798-12274193?url=http%3A%2F%2Fpt.dhgate.com%2Fproduct%2F128-64-32-16gb-class10-evo-plus-card-uhs%2F380563055.html	http://www.tqlkg.com/image-7893798-12274193	http://image.dhgate.com/600x600/f2/albu/g4/M01/F1/D0/rBVaEFcfG2qAfDQCAAB6CJRj6B8344.jpg	LeitoresdeCartõesdeMemória																yes			
DHGate	http://www.dhgate.com/	Portuguese Product Catalog	2016-06-16 00:55:31.989	2016 LED Shoes luminosos Atlético USB Boost Charging sapatos leves Unisex Sneakers de incandescência coloridos 6color transporte livre		Nós somos um fabricante de sapatos de China.There é um monte de sapatos têm um monte de inventory.If você pode se sentir livre para contactar-nos a qualquer momento, depois de colocar a ordem, damos-lhe a entrega no prazo de 3 dias úteis, verifique se o produto pode entrega atempada para as mãos	379787745					USD		29.15			http://www.jdoqocy.com/click-7893798-12274193?url=http%3A%2F%2Fpt.dhgate.com%2Fproduct%2F2016-led-luminous-shoes-yeezy-athletic-boost%2F379787745.html	http://www.tqlkg.com/image-7893798-12274193	http://image.dhgate.com/600x600/f2/albu/g4/M00/07/09/rBVaEVcUVgGALuaWAAWOE_PQlQI393.jpg	Sapatos ocasionais																yes			
DHGate	http://www.dhgate.com/	Portuguese Product Catalog	2016-06-16 00:55:31.989	T-shirt Atacado-HJ cosplay Wrestling Camisetas, Cena, Seth Rollins, Ryback, Reigns Roman, Daniel Bryan, John cena, Dolph Ziggler, o tamanho Sting plu		mais barato t-shirt barato, t-shirt da qualidade Compre com diretamente da camisa caso dos fornecedores de China: HJ cosplay johncena T-shirt O envio gratuito de Wrestling Cena ShirtUSD 10,99 / pieceHJ cosplay Wrestling Camisa johncena quot; 15Xquot; T	375502150					USD		27.82			http://www.tkqlhce.com/click-7893798-12274193?url=http%3A%2F%2Fpt.dhgate.com%2Fproduct%2Fwholesale-hj-cosplay-wrestling-shirts-t-shirt%2F375502150.html	http://www.tqlkg.com/image-7893798-12274193	http://image.dhgate.com/600x600/f2/albu/g1/M00/B2/7F/rBVaGFbdXhCAFiyDAAKPYszrPfU770.jpg	Camisetas																yes			
DHGate	http://www.dhgate.com/	Portuguese Product Catalog	2016-06-16 00:55:31.99	MGOO 2015 egípcio Pyramide leggings de impressão para as Mulheres Workout Clothes Leggings para a mulher Frete Grátis		Tamanho livre como o tamanho de gráfico mostrando estilo de moda de embalagem: pode ser como seu request condições de pagamento Paypal / TT	234087566					USD		13.71			http://www.dpbolvw.net/click-7893798-12274193?url=http%3A%2F%2Fpt.dhgate.com%2Fproduct%2Fmgoo-2015-egyptian-pyramide-print-leggings%2F234087566.html	http://www.tqlkg.com/image-7893798-12274193	http://image.dhgate.com/600x600/f2/albu/g2/M00/3F/B3/rBVaG1UdW7mAR-HHAAHkXM1Uf7k086.jpg	Colantes																yes			
DHGate	http://www.dhgate.com/	Portuguese Product Catalog	2016-06-16 00:55:31.99	Self Defense dispositivo Batom StyleTear agente de spray de pimenta cores 20ml-rosa 10pcs / lots		2pcs esquadrões da morte, Prata, Aço espanadores de junta de bronze Wushu Sanda auto-defesa anti lobo veículo de emergência	240520736					USD		27.4			http://www.kqzyfj.com/click-7893798-12274193?url=http%3A%2F%2Fpt.dhgate.com%2Fproduct%2Fself-defense-device-lipstick-styletear-agent%2F240520736.html	http://www.tqlkg.com/image-7893798-12274193	http://image.dhgate.com/600x600/f2/albu/g2/M01/0D/BB/rBVaG1Ve6reAbZsnAACweVQCPJc160.jpg	Equipamentosdeginásticaaoarlivre																yes			
DHGate	http://www.dhgate.com/	Portuguese Product Catalog	2016-06-16 00:55:31.99	New Jersey Argentina de futebol 16 17 MESSI casa DI MARIA AGUERO thai qualidade camisa de futebol Argentina jersey 2016		New 16/17 Argentina casa AAA thai qualidade de futebol veste .Quality: melhor qualidade Tamanho thai: tamanho US maneira S M L Trade XL: Misture a ordem por atacado e venda	377765689					USD		13.66			http://www.kqzyfj.com/click-7893798-12274193?url=http%3A%2F%2Fpt.dhgate.com%2Fproduct%2Fnew-argentina-soccer-jersey-16-17-messi-home%2F377765689.html	http://www.tqlkg.com/image-7893798-12274193	http://image.dhgate.com/600x600/f2/albu/g4/M00/55/21/rBVaEVb64YaAM_h0AABvDq-NPqI970.jpg	Jerseysdefutebol																yes			
DHGate	http://www.dhgate.com/	Portuguese Product Catalog	2016-06-16 00:55:31.991	Kit de silicone Set Com Silicone Dab Mat Pad Containers 7 ml quadrados para Dabs cera frascos inoxidável e ouro Titanium Ferramenta Dabber		1. Sem alcatrão e outras substâncias cancerígenas. 2. Inofensivo para outras pessoas ou o meio ambiente. 3. Nenhum perigo do fumo de segunda mão. 4. Pode fumar em um lugar público	376178034					USD		13.61			http://www.anrdoezrs.net/click-7893798-12274193?url=http%3A%2F%2Fpt.dhgate.com%2Fproduct%2Fsilicone-kit-set-with-silicone-dab-mat-pad%2F376178034.html	http://www.tqlkg.com/image-7893798-12274193	http://image.dhgate.com/600x600/f2/albu/g1/M00/E3/44/rBVaGVbrW4uANKliAAKKcGjunDo721.jpg	Outros Acessórios de e-Cig																yes			
