PROGRAMNAME	PROGRAMURL	CATALOGNAME	LASTUPDATED	NAME	KEYWORDS	DESCRIPTION	SKU	MANUFACTURER	MANUFACTURERID	UPC	ISBN	CURRENCY	SALEPRICE	PRICE	RETAILPRICE	FROMPRICE	BUYURL	IMPRESSIONURL	IMAGEURL	ADVERTISERCATEGORY	THIRDPARTYID	THIRDPARTYCATEGORY	AUTHOR	ARTIST	TITLE	PUBLISHER	LABEL	FORMAT	SPECIAL	GIFT	PROMOTIONALTEXT	STARTDATE	ENDDATE	OFFLINE	ONLINE	INSTOCK	CONDITION	WARRANTY	STANDARDSHIPPINGCOST
DHGate	http://www.dhgate.com/	Portuguese Product Catalog	2016-06-16 00:55:31.882	Nike Air Maxes 2016 Mens Tn Running Shoes, 100% Original Qualidade Nike Airmax Tn Executa Shoes 2016 frete grátis		Pagamento: 1. Nós aceitamos Alipay, West Union, Money Gram. Todos os principais cartões de crédito são aceitos através do processo de pagamento seguro ou Custódia. 2.Para problema de segurança, por favor confirme para Custódia depois que você recebeu. 3.Welcome sua presença, obrigado, desejo-lhe uma compra feliz	372487307					USD		46.97			http://www.jdoqocy.com/click-7893798-12274193?url=http%3A%2F%2Fpt.dhgate.com%2Fproduct%2F2016-nike-air-maxes-2015-tn-mens-running%2F372487307.html	http://www.tqlkg.com/image-7893798-12274193	http://image.dhgate.com/600x600/f2/albu/g3/M01/FC/0B/rBVaHVaYltmAFMP4AAxPGFqkU5k933.jpg	Calçadodecorrida																yes			
DHGate	http://www.dhgate.com/	Portuguese Product Catalog	2016-06-16 00:55:31.882	Livre AAA envio Top Quality Relógio de pulso Luxury 18K Rose Gold Mecânico Automático Esporte Mens Watch Relógios de homem		Automático Mecânica Relógios de pulso HEH32	168023130					USD		41.15			http://www.jdoqocy.com/click-7893798-12274193?url=http%3A%2F%2Fpt.dhgate.com%2Fproduct%2Faaa-top-quality-wristwatch-luxury-18k-rose%2F168023130.html	http://www.tqlkg.com/image-7893798-12274193	http://image.dhgate.com/albu_630988321_00/1.600x600.jpg	Relógiosde pulso																yes			
DHGate	http://www.dhgate.com/	Portuguese Product Catalog	2016-06-16 00:55:31.882	2016 de alta qualidade relogio G * 100 caixa de relógios dos esportes dos homens, homens marca de luxo assistir LED relógio de pulso cronógrafo, relógio militar, relógio digital de		Vendidos G relógio preço de fábrica estoque suficiente atacado, mais modelo disponível, o contato para o meu álbum	383352608					USD		39.98			http://www.jdoqocy.com/click-7893798-12274193?url=http%3A%2F%2Fpt.dhgate.com%2Fproduct%2F2016-top-quality-relogio-g-100-box-men-039%2F383352608.html	http://www.tqlkg.com/image-7893798-12274193	http://image.dhgate.com/600x600/f2/albu/g4/M00/C0/91/rBVaEFdBesOAAhSCAAHle0I8lNU848.jpg	Relógiosde pulso																yes			
DHGate	http://www.dhgate.com/	Portuguese Product Catalog	2016-06-16 00:55:31.883	Vestido Bonito Vinho Tinto longo da dama de honra com Sexy feitos à mão Flores Um ombro do chão Comprimento pick ups Elegant Chiffon Evening Prom		Cor: amarelo, rosa, coral, azul, mais cores para a escolha; Material: Chiffon; Tamanho: Tamanho padrão dos EUA 2, 4, 6, 8, etc. ou personalizado feito tamanho; Condição: Wedding, noite, festa, baile de finalistas, regresso a casa, etc.	256059851					USD		83.06			http://www.tkqlhce.com/click-7893798-12274193?url=http%3A%2F%2Fpt.dhgate.com%2Fproduct%2Fbeautiful-wine-red-long-bridesmaid-dress%2F256059851.html	http://www.tqlkg.com/image-7893798-12274193	http://image.dhgate.com/600x600/f2/albu/g2/M01/EF/53/rBVaGlX7vFCAN0KVAAG8LQLXC9A535.jpg	Vestido de damadehonra																yes			
DHGate	http://www.dhgate.com/	Portuguese Product Catalog	2016-06-16 00:55:31.883	Benchmade BK32 51 Balisong da borboleta de Morpho Faca BM42 BM47 faca tático facas de lâmina de faca dobrável azul / Red handle		Esta faca é um balisong edição limitada, ele vai embora em breve, por isso, se apresse up.This faca borboleta apresenta uma lâmina de aço inoxidável 440 e alças!	252704372					USD		13.93			http://www.tkqlhce.com/click-7893798-12274193?url=http%3A%2F%2Fpt.dhgate.com%2Fproduct%2Fbenchmade-bk32-51-balisong-morpho-butterfly%2F252704372.html	http://www.tqlkg.com/image-7893798-12274193	http://image.dhgate.com/600x600/f2/albu/g1/M01/B5/15/rBVaGVXdWuCAIpoXAArnMiOQ0QU111.jpg	FacaseFerramentas																yes			
DHGate	http://www.dhgate.com/	Portuguese Product Catalog	2016-06-16 00:55:31.884	Joyas Atacado-2015 banhado a ouro encantadores pendientes bonitos to.us suportar Stud Brincos Mulheres Brincos pendientes oso buho Charme boucle doreille		Anéis de noivado de jóias de moda baratos, Compro Qualidade superman fashion diretamente da China brincos violeta Fornecedores: 2015 joyas banhado a ouro encantadores pendientes bonitos to.us suportar Stud Brincos Mulheres Brincos pendientes oso boucl Charme	265694816					USD		20.83			http://www.anrdoezrs.net/click-7893798-12274193?url=http%3A%2F%2Fpt.dhgate.com%2Fproduct%2Fwholesale-2015-joyas-gold-plated-lovely-cute%2F265694816.html	http://www.tqlkg.com/image-7893798-12274193	http://image.dhgate.com/600x600/f2/albu/g3/M01/F2/9D/rBVaHVZIjOKAR9uQAATB-PwkmRQ944.jpg	Viga																yes			
DHGate	http://www.dhgate.com/	Portuguese Product Catalog	2016-06-16 00:55:31.884	Menor preço ! 2015 NOVO STAN SMITH Sapatilhas de couro CASUAL HOMENS E MULHERES 'S calçados esportivos FUNCIONAMENTO MOVIMENTANDO MEN clássico Moda FLATS SHOES		Frete grátis .. 1. A qualidade superior; 2. preço competitivo; 3. Frete grátis: Express; 4. transporte da gota disponível; 5. O melhor e serviço oportuno; 6. Satisfação 100%; 7. Big desconto para a ordem grande. size36-44	216418334					USD		19.99			http://www.kqzyfj.com/click-7893798-12274193?url=http%3A%2F%2Fpt.dhgate.com%2Fproduct%2F2015-dorp-shipping-casual-shoes-brand-renben%2F216418334.html	http://www.tqlkg.com/image-7893798-12274193	http://image.dhgate.com/600x600/f2/albu/g1/M00/D3/E5/rBVaGFWf1LuAd5LKAAJdQp9mOMI600.jpg	Sapatos ocasionais																yes			
DHGate	http://www.dhgate.com/	Portuguese Product Catalog	2016-06-16 00:55:31.884	Frete grátis 2015 Homens Jaket novos revestimentos jaqueta moda estilo homens homens casuais jaqueta quebra-vento casacos outwear 4 cores		Frete grátis 2015 Homens Jaket novos revestimentos jaqueta moda estilo homens homens casuais jaqueta quebra-vento casacos outwear 4 cores	231759216					USD		41.26			http://www.jdoqocy.com/click-7893798-12274193?url=http%3A%2F%2Fpt.dhgate.com%2Fproduct%2F2015-men-jaket-new-style-fashion-jacket-coats%2F231759216.html	http://www.tqlkg.com/image-7893798-12274193	http://image.dhgate.com/600x600/f2/albu/g1/M00/63/71/rBVaGVUHzbCAEI-uAAWkj1_HE9Y958.jpg	Jaquetas																yes			
DHGate	http://www.dhgate.com/	Portuguese Product Catalog	2016-06-16 00:55:31.884	Mais Populares Turbo Chaveiro Chaveiros Personalidade Liga O Ventilador De Ar Anel De Chave De Cadeia Turbina Do Turbocompressor Do Mancal		Mais Populares Turbo Chaveiro Chaveiros Personalidade Liga O Ventilador De Ar Anel De Chave De Cadeia Turbina Do Turbocompressor Do Mancal	245574538					USD		20.4			http://www.anrdoezrs.net/click-7893798-12274193?url=http%3A%2F%2Fpt.dhgate.com%2Fproduct%2Fmost-popular-turbo-keyring-keychains-personality%2F245574538.html	http://www.tqlkg.com/image-7893798-12274193	http://image.dhgate.com/600x600/f2/albu/g1/M00/09/2B/rBVaGFWV_dOAO4llAAJuxc3iT1o187.jpg	Acessórios deQuadrinhoseAnimeeFilmes																yes			
DHGate	http://www.dhgate.com/	Portuguese Product Catalog	2016-06-16 00:55:31.885	Atacado Atacado--Alta Qualityservice aço inoxidável 16,5 centímetros Pesca Alicate Linha cortador de gancho Ferramenta Enfrente Multi-função de pesca		Atacado Atacado--Alta Qualityamp; serviço de Aço Inoxidável 16,5 centímetros Pesca Alicate Linha cortador de gancho Ferramenta Enfrente Multi-função de pesca	247124277					USD		27.13			http://www.anrdoezrs.net/click-7893798-12274193?url=http%3A%2F%2Fpt.dhgate.com%2Fproduct%2Fwholesale-wholesale-high-quality-amp-service%2F247124277.html	http://www.tqlkg.com/image-7893798-12274193	http://image.dhgate.com/albu_1077147030_00/1.600x600.jpg																	yes			
DHGate	http://www.dhgate.com/	Portuguese Product Catalog	2016-06-16 00:55:31.885	Bayerns futebol Jersey 15 16 LEWANDOWSKI casa longe ROBBEN Götze MULLER qualidade thai camisa de futebol Bayerns camisa de futebol 2016		New 16/17 Bayerns casa e futebol thai qualidade afastado AAA usa .Quality: melhor qualidade Tamanho thai: tamanho US maneira S M L Trade XL: Misture a ordem por atacado e venda	377152132					USD		13.47			http://www.anrdoezrs.net/click-7893798-12274193?url=http%3A%2F%2Fpt.dhgate.com%2Fproduct%2Fbayerns-soccer-jersey-15-16-lewandowski-home%2F377152132.html	http://www.tqlkg.com/image-7893798-12274193	http://image.dhgate.com/600x600/f2/albu/g4/M01/46/E5/rBVaEFby7gaAMzOWAAB9p2qrI1Y111.jpg	Jerseysdefutebol																yes			
DHGate	http://www.dhgate.com/	Portuguese Product Catalog	2016-06-16 00:55:31.886	Venda Maquiagem Hot New Arrival Luster Lipstick Batom Geada Gia Valli coleção Matte Matte Lipstick Coleção 5colors Batom machisma		Bem-vindo à loja de miraclehappens quando sua ordem é mais do que 200usd U pode obter pelo menos 10USD cupons de esta ligação http://www.DHgate.com/store/19204152	374625743					USD		15.9			http://www.tkqlhce.com/click-7893798-12274193?url=http%3A%2F%2Fpt.dhgate.com%2Fproduct%2Fhot-new-arrival-makeup-luster-lipstick-frost%2F374625743.html	http://www.tqlkg.com/image-7893798-12274193	http://image.dhgate.com/600x600/f2/albu/g4/M00/F2/B5/rBVaEFc8FteAK-VyAAGC6mGinss774.jpg	Batom																yes			
DHGate	http://www.dhgate.com/	Portuguese Product Catalog	2016-06-16 00:55:31.886	Mãe elegante do laço dos vestidos de noiva 2016 Eiffelbride Sexy Ilusão 3/4 manga comprida A Linha prudentes vestidos de noite Vestidos Mãe formais		Tempo de entrega: 3-7 dias de trabalho. Tempo de processamento: 7-14 dias úteis. Tamanho: personalizado feito tamanho. Cor: feito sob encomenda da cor. Novo com etiquetas. 2016 vestidos de mãe do laço	235945887					USD		135.03			http://www.tkqlhce.com/click-7893798-12274193?url=http%3A%2F%2Fpt.dhgate.com%2Fproduct%2Fnew-six-colors-pearls-ringstone-beading-rose%2F235945887.html	http://www.tqlkg.com/image-7893798-12274193	http://image.dhgate.com/600x600/f2/albu/g4/M01/9D/60/rBVaEVc0I5qAHeNsAAMlIcLmUIA436.jpg	VestidosdeMãe																yes			
DHGate	http://www.dhgate.com/	Portuguese Product Catalog	2016-06-16 00:55:31.886	10pcs tira de led conector de 2 pinos 4pin 8mm 10mm L em forma de T, em forma de cruz em forma para 3528 única cor 5050 única cor led strip rgb		tira de led conector de 2 pinos 4pin 8mm 10mm L em forma de T, em forma de cruz em forma para 3528 única cor 5050 única cor led strip rgb	162280488					USD		9.8			http://www.kqzyfj.com/click-7893798-12274193?url=http%3A%2F%2Fpt.dhgate.com%2Fproduct%2F10pcs-led-strip-connector-2pin-4pin-8mm-10mm%2F162280488.html	http://www.tqlkg.com/image-7893798-12274193	http://image.dhgate.com/albu_743032382_00/1.600x600.jpg	OutrosAcessóriosdeIluminação																yes			
DHGate	http://www.dhgate.com/	Portuguese Product Catalog	2016-06-16 00:55:31.887	Frete grátis - 100 ml de DIY quadrado azul, frasco de perfume, 100cc quadrado azul, frasco pulverizador,100ml fragrância e perfume		Hotéis baratos de garrafa de secagem, Compre Qualidade frasco de perfume tipos diretamente da China desodorante perfumado Fornecedores:100ml frasco de plástico com pulverizador,100ml azul, frasco de perfume,100cc pulverizador bottlecapacity:100ml Cor: bluewe	178101057					USD		39.2			http://www.jdoqocy.com/click-7893798-12274193?url=http%3A%2F%2Fpt.dhgate.com%2Fproduct%2F100ml-diy-blue-square-perfume-bottle-100cc%2F178101057.html	http://www.tqlkg.com/image-7893798-12274193	http://image.dhgate.com/albu_511995903_00/1.600x600.jpg	Frasco de perfume																yes			
DHGate	http://www.dhgate.com/	Portuguese Product Catalog	2016-06-16 00:55:31.887	transporte livre dos esportes da forma do relógio GA100 G Display LED Moda exército militares relógios chocantes homens relógios casuais com caixa redonda		frete grátis Relógios Promoção Hardlex Chegada Nova Plastic unisex varejo de moda G Watch, GA100 fuso horário do relógio Watche	381003489					USD		12.92			http://www.jdoqocy.com/click-7893798-12274193?url=http%3A%2F%2Fpt.dhgate.com%2Fproduct%2Ffashion-sports-watch-ga100-g-display-led%2F381003489.html	http://www.tqlkg.com/image-7893798-12274193	http://image.dhgate.com/600x600/f2/albu/g4/M01/1C/C7/rBVaEFcpLxyAHiz7AAE-H1YqyJQ187.jpg	Relógiosde pulso																yes			
DHGate	http://www.dhgate.com/	Portuguese Product Catalog	2016-06-16 00:55:31.887	Atacado! 2016 New Desporto Bluetooth 4.0 Com TF Slot para cartão Wireless Headset fone de ouvido para o iphone Samsung Xiaomi etc, frete grátis		Estilo: In-Ear Pacote: Sem Uso: Portable Media Comunicação Jogador: Conectores sem fio: USB é sem fio: Sim Função: Bluetooth, Cancelamento de Ruído é personalizado: Não Especificação: Função V4.0 EDR:: Versão Bluetooth, handfree, Faixa de freqüência wireless : 2,4 GHz Talk Time: 4 Horas Tempo de espera: 160 horas de bateria recarregável: 150 mAh Tipo compatível: Dispositivos Bluetooth, PDA, PC etc.	375670807					USD		8.09			http://www.jdoqocy.com/click-7893798-12274193?url=http%3A%2F%2Fpt.dhgate.com%2Fproduct%2Fwholesale-2016-new-sport-bluetooth-4-0-with%2F375670807.html	http://www.tqlkg.com/image-7893798-12274193	http://image.dhgate.com/600x600/f2/albu/g4/M01/3A/D5/rBVaEFcMcICAbHB8AABRVLkn2bM095.jpg	Fonesdeouvido																yes			
DHGate	http://www.dhgate.com/	Portuguese Product Catalog	2016-06-16 00:55:31.888	TOP- frete grátis, 50pcs / do monte April Fool Day Gags piadas Brinquedos erros barata de plástico Drop Shipping, PW0072		Encontrar mais informações sobre frete grátis, 50pcs / lot April Fool # 039; s Gags Day piadas Brinquedos erros barata de plástico Drop Shipping, PW0072, flutuador brinquedo de alta qualidade, caixa de brinquedos China teddy bear fornecedores, bicicleta do brinquedo baratos de Pao Pao # 039; s loja on Aliexpress.com	269937801					USD		9.5			http://www.tkqlhce.com/click-7893798-12274193?url=http%3A%2F%2Fpt.dhgate.com%2Fproduct%2Ftop-50pcs-lot-april-fool-039-s-day-gags-practical%2F269937801.html	http://www.tqlkg.com/image-7893798-12274193	http://image.dhgate.com/600x600/f2/albu/g3/M01/58/AF/rBVaHFZtEt-AIDUEAALBkBnbyW8532.jpg	BrinquedosdePiadaseEngraçados																yes			
DHGate	http://www.dhgate.com/	Portuguese Product Catalog	2016-06-16 00:55:31.888	Alta Qualidade 30pcs / lot liga de zinco de Prata Artesanal Moda DNA fecho da lagosta encantos jóias para DIY		Alta Qualidade 30pcs / lot liga de zinco de Prata Artesanal Moda DNA fecho da lagosta encantos jóias para DIY	243800746					USD		20.58			http://www.jdoqocy.com/click-7893798-12274193?url=http%3A%2F%2Fpt.dhgate.com%2Fproduct%2Fhigh-quality-30pcs-lot-zinc-alloy-silver%2F243800746.html	http://www.tqlkg.com/image-7893798-12274193	http://image.dhgate.com/600x600/f2/albu/g2/M00/E5/71/rBVaG1WCJ9mAbY0fAABuWB5XHmg983.jpg	Feitiços																yes			
DHGate	http://www.dhgate.com/	Portuguese Product Catalog	2016-06-16 00:55:31.888	New Netherlands camisa de futebol 16 17 ROBBEN Início Laranja Longe azul KLAASSEN SNEIJDER V.PERSIE thai qualidade camisa Holandesa de Futebol 2016		Novas 16/17 Holanda Home and Away AAA futebol da qualidade thai veste .Quality: melhor qualidade Tamanho thai: tamanho US maneira S M L Trade XL: Misture a ordem por atacado e venda	377414131					USD		13.47			http://www.dpbolvw.net/click-7893798-12274193?url=http%3A%2F%2Fpt.dhgate.com%2Fproduct%2Fnew-netherlands-soccer-jersey-16-17-robben%2F377414131.html	http://www.tqlkg.com/image-7893798-12274193	http://image.dhgate.com/600x600/f2/albu/g4/M01/DE/A3/rBVaEFb1mROAMTluAABtWm6D7-c169.jpg	Jerseysdefutebol																yes			
DHGate	http://www.dhgate.com/	Portuguese Product Catalog	2016-06-16 00:55:31.889	Verus Capa Samsung Galaxy S7 Borda iPhone 6 6S Além disso Caso duplo em camadas à prova de choque Armadura Hard Case Voltar		Material: TPU macio + PC; Cor: Preto, branco, azul marinho, verde, rosa, vermelho, prata, ouro, verde do exército, verde; caso de dupla camada de armadura; modelo de vendas: misturar a ordem; transporte gratuito;	379797613					USD		65.2			http://www.jdoqocy.com/click-7893798-12274193?url=http%3A%2F%2Fpt.dhgate.com%2Fproduct%2Fverus-case-for-samsung-galaxy-s7-edge-iphone%2F379797613.html	http://www.tqlkg.com/image-7893798-12274193	http://image.dhgate.com/600x600/f2/albu/g4/M01/38/8D/rBVaEFcUeLqARM_aAAHn62KH_SE333.jpg	CasesparaCelulares																yes			
DHGate	http://www.dhgate.com/	Portuguese Product Catalog	2016-06-16 00:55:31.889	venda quente autênticos homens ocos integral relógios mecânicos homens mecânicos relógio dos relógios de homens		Desconto especial!!! VENDAS Factory Outlet !! Top qualidade.; Preço competitivo; transporte livre rápido fim Combin; transporte da gota disponível, melhor e serviço oportuno; Satisfação 100%; desconto grande para a ordem grande. misturamos atacado mens relógios de luxo e mulheres relógios de moda, forma das crianças relógios. barato boa qualidade China réplica pulso antique transporte watches.Free por EMS, DHL, HONG KONG POST. Presente de Natal!!! obrigado	216184904					USD		19.09			http://www.dpbolvw.net/click-7893798-12274193?url=http%3A%2F%2Fpt.dhgate.com%2Fproduct%2Fhot-selling-authentic-full-hollow-men-mechanical%2F216184904.html	http://www.tqlkg.com/image-7893798-12274193	http://image.dhgate.com/600x600/f2/albu/g2/M00/AB/A0/rBVaGlSiNBCAZn-0AAERK3cjz0A772.jpg	Relógiosde pulso																yes			
DHGate	http://www.dhgate.com/	Portuguese Product Catalog	2016-06-16 00:55:31.889	Hot New Arrival Maquiagem Luster Lipstick Batom Geada Gia Valli coleção Matte Lipstick Coleção 5colors Batom de alina		Shenzhen alina Co.Ltd especializada em Eletrônica Cliente. Com 5 anos # 039; experiência em serviços aduaneiros, Nossos produtos são principalmente cigarros E, DVD Filmes beleza saudável e bate fones de ouvido ...	378415203					USD		17.5			http://www.jdoqocy.com/click-7893798-12274193?url=http%3A%2F%2Fpt.dhgate.com%2Fproduct%2Fhot-new-arrival-makeup-luster-lipstick-frost%2F378415203.html	http://www.tqlkg.com/image-7893798-12274193	http://image.dhgate.com/600x600/f2/albu/g4/M01/5F/E1/rBVaEVcDmRaAWBWCAAHAvg8zpoo896.jpg	BrilhodeLábios																yes			
DHGate	http://www.dhgate.com/	Portuguese Product Catalog	2016-06-16 00:55:31.89	Nectar Collector com Titanium prego 14 milímetros Grau 2 Titanium Mini Cachimbo de Vidro Oil Rig mel Straw Concentre-mel Dab Straw Mini Bong		Qualidade Gleat kit coletor Nectar com Titanium prego Bongs Mini cachimbos de vidro 14 milímetros Hit suave conjunta Nectar Collector possui muitos em estoque Frete Grátis	248129773					USD		7.9			http://www.kqzyfj.com/click-7893798-12274193?url=http%3A%2F%2Fpt.dhgate.com%2Fproduct%2Fnectar-collector-with-titanium-nail-14mm%2F248129773.html	http://www.tqlkg.com/image-7893798-12274193	http://image.dhgate.com/600x600/f2/albu/g2/M00/45/9F/rBVaG1WuVPeAKgxmAAOEIYb4zis288.jpg	Outros Acessórios de fumo																yes			
DHGate	http://www.dhgate.com/	Portuguese Product Catalog	2016-06-16 00:55:31.89	St Louis #22 Brad Boyes Blues Premier Jerseys Blues time de Hockey Jerseys Top profissional barato Hockey vestuário Top Hockey Jersey China		Dar seus colegas entusiastas de hóquei um excelente show de orgulho da equipe. Inspirado pela impressionante engrenagem que jogadores de hóquei americana usam em campo e projetado para o conforto total esta réplica jersey recursos um ajuste sob medido projetados para facilitar o movimento. Seu bordado de número de jogador favorito sobre a frente e para trás, assim você pode ficar, sem dúvida, fiel à sua equipe o dia todo todos os dias, especialmente dia de jogo!	181589194					USD		34.02			http://www.dpbolvw.net/click-7893798-12274193?url=http%3A%2F%2Fpt.dhgate.com%2Fproduct%2Fst-louis-22-brad-boyes-blues-premier-jerseys%2F181589194.html	http://www.tqlkg.com/image-7893798-12274193	http://image.dhgate.com/albu_561654014_00/1.600x600.jpg	HockeyMalhas																yes			
DHGate	http://www.dhgate.com/	Portuguese Product Catalog	2016-06-16 00:55:31.89	50PC 14g Multi-Color Gemmed Anéis da barriga Bares Umbigo Piercing Jóias BPJ91 frete grátis		Belly Atacado Botão umbigo Anéis Body Piercing material de jóias: o tamanho de aço inoxidável 316L: Quantidade 14g: 50pcs / lot	130826829					USD		18.45			http://www.tkqlhce.com/click-7893798-12274193?url=http%3A%2F%2Fpt.dhgate.com%2Fproduct%2F50pc-14g-multi-color-gemmed-belly-rings-navel%2F130826829.html	http://www.tqlkg.com/image-7893798-12274193	http://image.dhgate.com/albu_219170955_00/1.600x600.jpg	Umbigo&BellAnelsBotão																yes			
DHGate	http://www.dhgate.com/	Portuguese Product Catalog	2016-06-16 00:55:31.891	Anti Aging Skin Cuidados Scar Stretch Mark Redutores Auto Derma elétrica Pen Stamp Auto Micro Needle Wand rolo com 2pcs Dicas 12Needle		1.Anti-Puffiness, 2. Stretch Mark Remoção e Stretch Mark Tratamento 3.Acne Cicatriz Remoção, Acne Cicatriz Tratamento 4 Anti-rugas Tratamento, Anti Aging 5. Queda de cabelo Tratamentos ou Hair Restoration 6.Surgical cicatriz remoção 7. pode ser usado para 1,3,9,12,36, agulha nano pinos e assim por diante, se o cartucho é acoplamento de baioneta	377784285					USD		36.75			http://www.anrdoezrs.net/click-7893798-12274193?url=http%3A%2F%2Fpt.dhgate.com%2Fproduct%2Fanti-aging-skin-care-scar-stretch-mark-reducers%2F377784285.html	http://www.tqlkg.com/image-7893798-12274193	http://image.dhgate.com/600x600/f2/albu/g4/M00/38/8D/rBVaEFb7P1CAcfmNAAaolOHuknk644.jpg	Micro-agulharolo																yes			
DHGate	http://www.dhgate.com/	Portuguese Product Catalog	2016-06-16 00:55:31.891	Homens Assista 2,015 homem assistir quartzo inoxidável luxo de aço de aço relógio de pulso Casual relógios marca de relógios relógio Militar		Homens Assista 2,015 homem assistir quartzo inoxidável luxo de aço de aço relógio de pulso Casual relógios marca de relógios relógio Militar	376473237					USD		18.29			http://www.tkqlhce.com/click-7893798-12274193?url=http%3A%2F%2Fpt.dhgate.com%2Fproduct%2Fhomens-assista-2015-man-watch-stainless-steel%2F376473237.html	http://www.tqlkg.com/image-7893798-12274193	http://image.dhgate.com/600x600/f2/albu/g1/M01/39/03/rBVaGVbuEViADh_PAAFbiXzvUxE955.jpg	Relógiosde pulso																yes			
DHGate	http://www.dhgate.com/	Portuguese Product Catalog	2016-06-16 00:55:31.891	Selo Dermapen caneta derma MYM derma e 2pcs pontas de agulha, caneta meso derma elétrica selo, MYM caneta derma, roller micro agulha, equipamentos de beleza		Comprimento 1.needle ajustar 0,25-2,0 mm pen venda massagem rolo 2.cellulite 3.Hot derma caneta derma 4.electrical dermaroller, melhores rolos derma, 540 titanium derma rolo de microagulhas	371904019					USD		34.29			http://www.tkqlhce.com/click-7893798-12274193?url=http%3A%2F%2Fpt.dhgate.com%2Fproduct%2Fdermapen-derma-pen-mym-derma-stamp-and-2pcs%2F371904019.html	http://www.tqlkg.com/image-7893798-12274193	http://image.dhgate.com/600x600/f2/albu/g2/M01/EF/73/rBVaGlZlNLKAbFB6AASqTTe6ICA073.jpg	Micro-agulharolo																yes			
DHGate	http://www.dhgate.com/	Portuguese Product Catalog	2016-06-16 00:55:31.892	2015 mais novo Spy Mini escondido DVR da câmara Botão de áudio e vídeo PC DVR Gravador de Voz DVR Cam 1080p preto novo mini Filmadoras		Navio livre V18 Mini AV HD 1920x1080 30fps Camera tabela oculta Spy Relógio	258721991					USD		32.19			http://www.tkqlhce.com/click-7893798-12274193?url=http%3A%2F%2Fpt.dhgate.com%2Fproduct%2F2015-newest-spy-mini-hidden-dvr-camera-button%2F258721991.html	http://www.tqlkg.com/image-7893798-12274193	http://image.dhgate.com/600x600/f2/albu/g2/M01/5A/60/rBVaGlYWH_mAcWZFAAJHH0_NzQ8496.jpg	CâmerasBotãoEspião																yes			
DHGate	http://www.dhgate.com/	Portuguese Product Catalog	2016-06-16 00:55:31.892	Qualidade Hard Top 2.2 "CNC erva muller mão herbal triturador moedor de 4 partes e imprensa pólen conjunto de combinação poupar dinheiro		Engrenagem moedor barato, comprar moedor de Qualidade plástico diretamente da China Moinho de Fornecedores elétricos: A cor para o moedor é aleatória, a não ser que você deixe uma mensagem para a cor. Descrição: Este	267297986					USD		18.23			http://www.dpbolvw.net/click-7893798-12274193?url=http%3A%2F%2Fpt.dhgate.com%2Fproduct%2Fquality-hard-top-2-2-quot-cnc-herb-herbal%2F267297986.html	http://www.tqlkg.com/image-7893798-12274193	http://image.dhgate.com/600x600/f2/albu/g1/M01/1D/58/rBVaGFZUYYOAAjcbAAEM_OBUv9Y220.jpg	Outros Acessórios de fumo																yes			
DHGate	http://www.dhgate.com/	Portuguese Product Catalog	2016-06-16 00:55:31.892	Sexy Womens Bodycon Vestidos PU lápis de couro calças na altura do joelho manga curta Vestido Preto Voltar Clubwear Hip Maxi Casual Vestidos Para Mulheres		vestidos de noite 1.Color: marfim branco ou escolher na cor acelga 2.Size: escolher em tamanho acelga ou 3.OEM custom_made	270174213					USD		19.43			http://www.dpbolvw.net/click-7893798-12274193?url=http%3A%2F%2Fpt.dhgate.com%2Fproduct%2Fsexy-womens-bodycon-dresses-pu-leather-pencil%2F270174213.html	http://www.tqlkg.com/image-7893798-12274193	http://image.dhgate.com/600x600/f2/albu/g3/M00/4E/F1/rBVaHFZxJqmAFQPlAADx3QcaK-I861.jpg	Vestidoscasuais																yes			
