PROGRAMNAME	PROGRAMURL	CATALOGNAME	LASTUPDATED	NAME	KEYWORDS	DESCRIPTION	SKU	MANUFACTURER	MANUFACTURERID	UPC	ISBN	CURRENCY	SALEPRICE	PRICE	RETAILPRICE	FROMPRICE	BUYURL	IMPRESSIONURL	IMAGEURL	ADVERTISERCATEGORY	THIRDPARTYID	THIRDPARTYCATEGORY	AUTHOR	ARTIST	TITLE	PUBLISHER	LABEL	FORMAT	SPECIAL	GIFT	PROMOTIONALTEXT	STARTDATE	ENDDATE	OFFLINE	ONLINE	INSTOCK	CONDITION	WARRANTY	STANDARDSHIPPINGCOST
DHGate	http://www.dhgate.com/	Portuguese Product Catalog	2016-06-16 00:55:31.783	Kanger Subox Mini Starter Kit alta qualidade cores brancas e pretas subox mini-caixa de mod kit frete grátis DHL atacado.		Kanger Subox Mini kit inicial de alta qualidade	380840426					USD		118.35			http://www.jdoqocy.com/click-7893798-12274193?url=http%3A%2F%2Fpt.dhgate.com%2Fproduct%2Fkanger-subox-mini-starter-kit-high-quality%2F380840426.html	http://www.tqlkg.com/image-7893798-12274193	http://image.dhgate.com/600x600/f2/albu/g4/M00/C7/53/rBVaEFckbvCAJH2YAABRUTUtA0c358.jpg	E-cigarro Mods																yes			
DHGate	http://www.dhgate.com/	Portuguese Product Catalog	2016-06-16 00:55:31.783	Novos quentes - 2015 outono sapatos desportivos, de alta qualidade e homens elegantes e mulheres com calçados esportivos sapatos confortáveis ​​executando		nova moda unissex elevadas baixas sapatilhas das mulheres dos homens para homens tênis para mulheres e sapatos de lona	193163401					USD		30.77			http://www.dpbolvw.net/click-7893798-12274193?url=http%3A%2F%2Fpt.dhgate.com%2Fproduct%2Fnew-fashion-unisex-high-low-men-women-sneakers%2F193163401.html	http://www.tqlkg.com/image-7893798-12274193	http://image.dhgate.com/600x600/f2/albu/g1/M01/3F/15/rBVaGFXUhjeAT60SAAj8Ma41D88244.jpg	Calçadodecorrida																yes			
DHGate	http://www.dhgate.com/	Portuguese Product Catalog	2016-06-16 00:55:31.784	Da cintura para baixo Macio e roupa interior dos homens modal respirável Sexy Moda Elastic Thong G-string 7 Cores NK36		* Cor: preto, branco, azul, vermelho, cinza claro, cinza escuro e verde. * Material: modal. * Tamanho: M, L, XL. * Modelo de vendas: a ordem da mistura. * Quantidade: 5 itens por lote	238833446					USD		29.55			http://www.tkqlhce.com/click-7893798-12274193?url=http%3A%2F%2Fpt.dhgate.com%2Fproduct%2Fsexy-low-waist-modal-men-039-s-underwear%2F238833446.html	http://www.tqlkg.com/image-7893798-12274193	http://image.dhgate.com/600x600/f2/albu/g2/M01/15/13/rBVaG1VN0VWAZNhmAAoJfg2oeRo531.jpg	FiodentaleTangasmasculino																yes			
DHGate	http://www.dhgate.com/	Portuguese Product Catalog	2016-06-16 00:55:31.784	Atacado-54 cores Conjunto de tinta de alta qualidade Hao Tattoo Maquiagem Corpo Profissional Pigment 5ML Ink Tattoo Set Pigment Cosmetic Cor Tattoo		Tubo de tatuagem barato, comprar qualidade tatuagem tinta preta diretamente da China tatuagem Fornecedores de pós-tratamento: Forma 14 Colors Pigment Tattoo Professional Conjunto Completo uma onça 30ml / garrafa Kit Tattoo Ink para Body Art TattooUSD 46,68 / l	262497144					USD		58.54			http://www.tkqlhce.com/click-7893798-12274193?url=http%3A%2F%2Fpt.dhgate.com%2Fproduct%2Fwholesale-54-colors-set-high-quality-hao%2F262497144.html	http://www.tqlkg.com/image-7893798-12274193	http://image.dhgate.com/600x600/f2/albu/g2/M01/68/69/rBVaG1YyyxSADuU_AAKbMBD2SWo246.jpg	Tintas detatuagem																yes			
DHGate	http://www.dhgate.com/	Portuguese Product Catalog	2016-06-16 00:55:31.784	Spyderco New C07S faca ao ar livre dobrável, material da lâmina 9cr18mov, Pega de aço inoxidável material, ao ar livre ferramentas de acampamento mão EDC.Wholesale		Atacado, varejo, não hesite em contactar-nos	381714489					USD		27.54			http://www.kqzyfj.com/click-7893798-12274193?url=http%3A%2F%2Fpt.dhgate.com%2Fproduct%2Fspyderco-new-c07s-outdoor-folding-knife-9cr18mov%2F381714489.html	http://www.tqlkg.com/image-7893798-12274193	http://image.dhgate.com/600x600/f2/albu/g4/M01/42/71/rBVaEVc2soqABm_FAAGCIS4KT7Q323.jpg	FacaseFerramentas																yes			
DHGate	http://www.dhgate.com/	Portuguese Product Catalog	2016-06-16 00:55:31.785	TNT pós Goophone i6 android 4.7inch I6 acrescida de 5,5 polegadas MTK6582 Quad Core 1GB Ram 8GB Rom entregas smartphone 3G Freeshipping		HDC android 4.7inch I6 i6 + 5,5 polegadas do smartphone móvel MTK6582 Quad Core 1GB Ram 8GB Rom inteligente Phone3G	218016317					USD		78.69			http://www.tkqlhce.com/click-7893798-12274193?url=http%3A%2F%2Fpt.dhgate.com%2Fproduct%2Ftnt-post-goophone-android-i6-4-7inch-i6-plus%2F218016317.html	http://www.tqlkg.com/image-7893798-12274193	http://image.dhgate.com/600x600/f2/albu/g2/M01/BC/D1/rBVaGlTDOTmADyyIAADeYuGVtYU926.jpg	Telemóveis																yes			
DHGate	http://www.dhgate.com/	Portuguese Product Catalog	2016-06-16 00:55:31.785	Elegante 2015 vestidos de noiva sereia V-Neck vestidos de noiva sexy do laço apliques de alta qualidade vestido de noiva mangas SX226		Quer olhar suave e feminina em seus vestidos de festa? 1. Feitos seu próprio tamanho. 2. Feitos sua própria cor.	230495276					USD		177.15			http://www.dpbolvw.net/click-7893798-12274193?url=http%3A%2F%2Fpt.dhgate.com%2Fproduct%2Felegant-2015-wedding-dresses-mermaid-maison%2F230495276.html	http://www.tqlkg.com/image-7893798-12274193	http://image.dhgate.com/600x600/f2/albu/g2/M01/9D/67/rBVaGlTyqmGATsMDAADKf6-h1d0641.jpg	Vestidos de noiva Sereia																yes			
DHGate	http://www.dhgate.com/	Portuguese Product Catalog	2016-06-16 00:55:31.785	dupla reciclador bongo phonix científica bong klein reciclador vapor pulso plataforma de petróleo tubo de água de vidro bio dab plataforma de petróleo nave-mãe de vidro		vidro transparente bong envio com frete grátis montagem com embalagem com cuidado, made in China, você pode obter todas as coisas com as imagens reais mostram	257503291					USD		29.59			http://www.jdoqocy.com/click-7893798-12274193?url=http%3A%2F%2Fpt.dhgate.com%2Fproduct%2F2015-oil-rigs-bongs-glass-roor-bong-10-quot%2F257503291.html	http://www.tqlkg.com/image-7893798-12274193	http://image.dhgate.com/600x600/f2/albu/g3/M00/AF/2F/rBVaHFZ44SOAYdS2AAIXkZhg0D8273.jpg	Cachimbosde água																yes			
DHGate	http://www.dhgate.com/	Portuguese Product Catalog	2016-06-16 00:55:31.786	2015 Miriya real Amostra Branco Sexy Spaghetti Backless praia vestidos de casamento simples Lace Chiffon Boho vestidos de casamento de Verão		Alta qualidade, preço baixo, primeiro transporte. Porque a nossa loja é novo, não são ordens, por isso nossas vantagens paraíso # 039; t mostrado para fora, à espera de sua vinda, querida. vestidos vintage estilo do casamento, aberto vestidos de noiva para trás, vestidos de casamento islâmico. Mais você comprar, mais desconto vai lhe dar. Se você tiver qualquer problema, basta contactar-nos, nós # 039; vai ser muito feliz em ajudá-lo.	250419481					USD		178.29			http://www.tkqlhce.com/click-7893798-12274193?url=http%3A%2F%2Fpt.dhgate.com%2Fproduct%2F2015-miriya-real-sample-white-sexy-spaghetti%2F250419481.html	http://www.tqlkg.com/image-7893798-12274193	http://image.dhgate.com/600x600/f2/albu/g3/M00/7E/C8/rBVaHVXEPx-AN3UuAAN8tCArLdg235.jpg	Outros vestidos de casamento																yes			
DHGate	http://www.dhgate.com/	Portuguese Product Catalog	2016-06-16 00:55:31.786	OMYU vitamina c 0riginal líquido Whitening Sarda Acne Remover Scar idealista Preferred Escort para a sua pele ácido hialurônico 10ml Fluido / pcs		Especificações: Vitamina C + ácido hialurônico + Butanediol + Água deionizada + pacote essência outra nutrição da pele Cactus + Aloe Extract + incluem: 10ml * 2 + gotejadores * 2	176439627					USD		18.14			http://www.dpbolvw.net/click-7893798-12274193?url=http%3A%2F%2Fpt.dhgate.com%2Fproduct%2Fomyu-vitamin-c-0riginal-liquid-whitening%2F176439627.html	http://www.tqlkg.com/image-7893798-12274193	http://image.dhgate.com/albu_494692592_00/1.600x600.jpg	Cremes&loção																yes			
DHGate	http://www.dhgate.com/	Portuguese Product Catalog	2016-06-16 00:55:31.786	Professional máquina de tatuagem maquiagem de alta qualidade máquina de tatuagem rotativo para a composição frete grátis		Máquina de tatuagem maquiagem permanente de alta qualidade máquina de tatuagem rotativo frete grátis	168280823					USD		30.16			http://www.tkqlhce.com/click-7893798-12274193?url=http%3A%2F%2Fpt.dhgate.com%2Fproduct%2Fprofessional-makeup-tattoo-machine-high-quality%2F168280823.html	http://www.tqlkg.com/image-7893798-12274193	http://image.dhgate.com/albu_409747738_00/1.600x600.jpg	Máquinas de maquiagem definitiva																yes			
DHGate	http://www.dhgate.com/	Portuguese Product Catalog	2016-06-16 00:55:31.787	2016 New Maquiagem Retro Matte Lipstick longo Última Nude Batom melhor qualidade tem 24 cores diferentes com o Inglês Nome 3,0 g (50 unidades / lote)		2016 new retro Matte Lipstick, tem 24 cores diferentes, cada um tem o logotipo da marca e a crina Inglês nele. você pode escolher você como a cor ou misturá-los.	376031211					USD		120.26			http://www.dpbolvw.net/click-7893798-12274193?url=http%3A%2F%2Fpt.dhgate.com%2Fproduct%2F2016-new-makeup-retro-matte-lipstick-long%2F376031211.html	http://www.tqlkg.com/image-7893798-12274193	http://image.dhgate.com/600x600/f2/albu/g3/M00/E5/D5/rBVaHFbk8oeAR73oAAIjSDag6ZY965.jpg	Batom																yes			
DHGate	http://www.dhgate.com/	Portuguese Product Catalog	2016-06-16 00:55:31.787	Sobrancelha Pen tatuagem Microblading manual 5pcs 3D Handmade Cosméticos tatuagem sobrancelha Pen Máquina permanente da composição		5pcs Manual tatuagem caneta de maquiagem permanente sobrancelha caneta bordados para delineador lábio sobrancelha	260474541					USD		12.75			http://www.dpbolvw.net/click-7893798-12274193?url=http%3A%2F%2Fpt.dhgate.com%2Fproduct%2F5pcs-3d-handmade-manual-cosmetic-tattoo-eyebrow%2F260474541.html	http://www.tqlkg.com/image-7893798-12274193	http://image.dhgate.com/600x600/f2/albu/g4/M01/77/37/rBVaEVcJ_3-AX-ziAAB7_vJaspU090.jpg	Máquinas de maquiagem definitiva																yes			
DHGate	http://www.dhgate.com/	Portuguese Product Catalog	2016-06-16 00:55:31.787	100pcs / lot Marvel Super Heroes Avengers Batman Star Wars MinifiguresBuilding Blocos Tijolos Figuras		100pcs / lot Marvel Super Heroes Avengers Batman Star Wars MinifiguresBuilding Blocos Tijolos Figuras	211573792					USD		73.83			http://www.dpbolvw.net/click-7893798-12274193?url=http%3A%2F%2Fpt.dhgate.com%2Fproduct%2F100pcs-lot-marvel-super-hero-spiderman-hulk%2F211573792.html	http://www.tqlkg.com/image-7893798-12274193	http://image.dhgate.com/600x600/f2/albu/g4/M00/EE/B5/rBVaEVdB1dGACG21AAXCfYhva94209.jpg	Blocos																yes			
DHGate	http://www.dhgate.com/	Portuguese Product Catalog	2016-06-16 00:55:31.787	Luxo árabes Vestidos de noite Sereia Red Bling lantejoulas Tulle Lace 2015 Sheer Spaghetti Sexy Tulle Pageant Dresses Prom Vestidos de celebridades Longo		Este vestido é projetado pelo designer popular e amado por muitas mulheres. É frete grátis e de alta qualidade e preço competitivo.	256615033					USD		185.06			http://www.dpbolvw.net/click-7893798-12274193?url=http%3A%2F%2Fpt.dhgate.com%2Fproduct%2Fluxury-arabic-evening-dresses-mermaid-red%2F256615033.html	http://www.tqlkg.com/image-7893798-12274193	http://image.dhgate.com/600x600/f2/albu/g2/M00/53/18/rBVaG1YBG1aAOuwIAAH1oeG_VSI657.jpg	Vestidos																yes			
DHGate	http://www.dhgate.com/	Portuguese Product Catalog	2016-06-16 00:55:31.788	2016 VENDA QUENTE! 50pcs / lot 600D-G 3RS esterilizados descartáveis ​​agulhas de tatuagem permanente da composição da sobrancelha Agulhas Abastecimento com apertos de Nouveau Contour		Tamanhos estão disponíveis: Round Liner (RL): 1. 2. 3. 5. 7. 8. 9. 11. 13. 14. 15. Rodada Shader (RS): 2. 3. 5. 7. 8. 9. 11. 13. 14. 15. Plano Shader Bevel (F): 3. 4. 5. 7. 9. Plano Shader (F): 3. 4. 5. 7. 9. 11. 13. 15. Único Stack Magnum (M1): 5. 7. 9. 11. 13. 15. Double Stack Magnum (M2): 5. 7. 9. 11. 13. 15. Rodada Magnum (RM ): 5. 7. 9. 11. 13. 15.	371535742					USD		28.53			http://www.anrdoezrs.net/click-7893798-12274193?url=http%3A%2F%2Fpt.dhgate.com%2Fproduct%2F2016-hot-sale-50pcs-lot-600d-g-3rs-sterilized%2F371535742.html	http://www.tqlkg.com/image-7893798-12274193	http://image.dhgate.com/600x600/f2/albu/g3/M00/5E/13/rBVaHFaJ5r-ATlj0AACeXXEBtrw312.jpg	Agulhasepontasdemaquiagem definitiva																yes			
DHGate	http://www.dhgate.com/	Portuguese Product Catalog	2016-06-16 00:55:31.788	Whosales TOP 3A +++ Qualidade 2016 West Ham Futebol CHANDAL Oeste Hamm United FC barato 15/16 PAYET NOBRE CARROLL camisas uniformes de futebol		preço competitivo ! mais desconto para mais ordens! qualidade em primeiro lugar! cliente em primeiro lugar! serviço excelente ! entrega rápida ! a ordem da mistura disponível! Gota disponível! Bem-vindo ao Varejo e Atacado!	380496767					USD		18.58			http://www.kqzyfj.com/click-7893798-12274193?url=http%3A%2F%2Fpt.dhgate.com%2Fproduct%2Fwhosales-top-3a-quality-2016-west-ham-soccer%2F380496767.html	http://www.tqlkg.com/image-7893798-12274193	http://image.dhgate.com/600x600/f2/albu/g4/M01/CA/BD/rBVaEVceBDSAPbRjAAbfsl0G2i0564.jpg	Jerseysdefutebol																yes			
DHGate	http://www.dhgate.com/	Portuguese Product Catalog	2016-06-16 00:55:31.788	Onda do corpo brasileiro Lace Closures Pieces Cabelo Humano 8 "-20" (4 * 4) Mais Closures barato cabelo humano onda / encaracolados / Encerramento reta profunda		1.Color: Natural 2.Length Cor: 8-24 polegadas. 3.Style:Body Onda, em linha reta, culry, 4.Grade onda profunda: AAAAA 5.Weight: frete grátis 15-30g / pc 6.DHL	154391216					USD		51.04			http://www.kqzyfj.com/click-7893798-12274193?url=http%3A%2F%2Fpt.dhgate.com%2Fproduct%2Funprocessed-virgin-brazilian-lace-closure%2F154391216.html	http://www.tqlkg.com/image-7893798-12274193	http://image.dhgate.com/600x600/f2/albu/g4/M01/2A/F1/rBVaEFdRVMeANPtaAAMjRPArBi0302.jpg	Tramas de cabelo																yes			
DHGate	http://www.dhgate.com/	Portuguese Product Catalog	2016-06-16 00:55:31.789	Top qualidade jersey EUA 2016 casa DEMPSEY branco Yedlin DONOVAN JONES Altidore afastado preta camisa de futebol EUA camisa de futebol masculino 2016		New 2,016 EUA casa e fora AAA thai qualidade de futebol veste .Quality: melhor qualidade Tamanho thai: tamanho US maneira S M L Trade XL: Misture a ordem por atacado e venda	376992315					USD		13.66			http://www.tkqlhce.com/click-7893798-12274193?url=http%3A%2F%2Fpt.dhgate.com%2Fproduct%2Ftop-quality-usa-jersey-2016-home-white-dempsey%2F376992315.html	http://www.tqlkg.com/image-7893798-12274193	http://image.dhgate.com/600x600/f2/albu/g4/M01/B1/61/rBVaEFbxGKuAa3g6AAR19K3nfHk896.jpg	Jerseysdefutebol																yes			
DHGate	http://www.dhgate.com/	Portuguese Product Catalog	2016-06-16 00:55:31.789	1pcs com caixa de metal, relógios desportivos masculinos clássicos Relogio, LED relógio de pulso cronógrafo, relógio militar, relógio digital, bom presente para homens		Vendidos G relógio preço de fábrica estoque suficiente atacado, mais modelo disponível, o contato para o meu álbum	375239134					USD		13.07			http://www.jdoqocy.com/click-7893798-12274193?url=http%3A%2F%2Fpt.dhgate.com%2Fproduct%2F1pcs-with-tin-box-relogio-classic-men-039%2F375239134.html	http://www.tqlkg.com/image-7893798-12274193	http://image.dhgate.com/600x600/f2/albu/g1/M00/46/8B/rBVaGFZzvP6ATzoFAAGLZkCl2wE326.jpg	Relógiosde pulso																yes			
DHGate	http://www.dhgate.com/	Portuguese Product Catalog	2016-06-16 00:55:31.789	New France Europe copo Jersey 15 16 BENZEMA casa longe Pogba GIROUD Ribéry NASRI thai qualidade França camisa de futebol camisa de futebol 2016		New 16/17 França casa e fora AAA thai qualidade de futebol veste .Quality: melhor qualidade Tamanho thai: tamanho US maneira S M L Trade XL: Misture a ordem por atacado e venda	377874424					USD		13.66			http://www.jdoqocy.com/click-7893798-12274193?url=http%3A%2F%2Fpt.dhgate.com%2Fproduct%2Fnew-france-europe-cup-jersey-15-16-benzema%2F377874424.html	http://www.tqlkg.com/image-7893798-12274193	http://image.dhgate.com/600x600/f2/albu/g4/M00/56/CF/rBVaEVb8PwWAHokGAABV3zrWkc8275.jpg	Jerseysdefutebol																yes			
DHGate	http://www.dhgate.com/	Portuguese Product Catalog	2016-06-16 00:55:31.79	On-line China Jordan Shoes 14 basquete Sneakers Homens 2016 branco autêntica retro 14s Ferraris Laney Sports Homme Baixo China Jordans sapatos		qualidade China Jordan sapatas de basquetebol superiores, a qualidade de primeira classe, o original de fábrica preço de atacado, aceitar a ordem da seqüência mista, entrega gratuita, bem-vindo para postar consulta!	270810270					USD		62.97			http://www.tkqlhce.com/click-7893798-12274193?url=http%3A%2F%2Fpt.dhgate.com%2Fproduct%2F2016-aires-fashion-china-jordan-14-basketball%2F270810270.html	http://www.tqlkg.com/image-7893798-12274193	http://image.dhgate.com/600x600/f2/albu/g4/M01/F0/80/rBVaEVdaYryANEDlAACoUNvOEgo952.jpg	Tênisdebasquete																yes			
DHGate	http://www.dhgate.com/	Portuguese Product Catalog	2016-06-16 00:55:31.79	2pcs MT 540 titânio Micro rolos de agulhas Pele Dermatologia terapia, pele Microneedle Dermaroller 2pcs transporte da gota		1. Estimular a produção de colágeno 2. melhorar a elasticidade da pele 3. Reduzir o tamanho dos poros e firmar 4. suavizar cicatrizes de acne 5. Reduzir linhas finas, rugas e olheiras.	191429854					USD		11.74			http://www.kqzyfj.com/click-7893798-12274193?url=http%3A%2F%2Fpt.dhgate.com%2Fproduct%2Fmt-titanium-540-micro-needle-skin-roller%2F191429854.html	http://www.tqlkg.com/image-7893798-12274193	http://image.dhgate.com/albu_722959945_00/1.600x600.jpg	Micro-agulharolo																yes			
DHGate	http://www.dhgate.com/	Portuguese Product Catalog	2016-06-16 00:55:31.79	Selos para o EMS DHL China post epacket		Selos para o EMS DHL China post epacket	256074515					USD		1			http://www.jdoqocy.com/click-7893798-12274193?url=http%3A%2F%2Fpt.dhgate.com%2Fproduct%2Fpostage-for-ems-dhl-china-post-epacket%2F256074515.html	http://www.tqlkg.com/image-7893798-12274193	http://image.dhgate.com/600x600/f2/albu/g2/M01/68/CB/rBVaGlX70s2AROo5AADPnx0BT2U055.jpg	Outros Acessórios de e-Cig																yes			
DHGate	http://www.dhgate.com/	Portuguese Product Catalog	2016-06-16 00:55:31.791	4pcs / set New Moda feminina Lash pacote PU bolsas de couro de crocodilo padrão de bolsa de ombro envio Crossbody Bag Clutch Bag grátis		Tipo: Messenger Bags Material: PU estilo: moda Padrão: Planície de gênero: tipo de padrão mulheres: Saco de crocodilo padrão sólido: other Peso bruto / Embalagem: 0,4 (kg)	247171139					USD		26.22			http://www.kqzyfj.com/click-7893798-12274193?url=http%3A%2F%2Fpt.dhgate.com%2Fproduct%2F4pcs-set-new-fashion-women-lash-package-pu%2F247171139.html	http://www.tqlkg.com/image-7893798-12274193	http://image.dhgate.com/600x600/f2/albu/g3/M01/B9/F9/rBVaHFX_kx6ANqmIAAEwJ4QkmuE033.jpg	Totes																yes			
DHGate	http://www.dhgate.com/	Portuguese Product Catalog	2016-06-16 00:55:31.791	Atacado-novas 2016 mulheres e homem do urso pouco pulseira Diam0nd pulseiras tb796 pulseira urso de aço inoxidável		pulseira Chamilia barato, comprar pulseira Qualidade homens diretamente de pulseira pulseira Fornecedores China: alta qualidade casuais 2015 mulheres colar de aço inoxidável urso colar urso tn303 USD 3,36 / piecenew 2015 mulheres	377403037					USD		18.35			http://www.dpbolvw.net/click-7893798-12274193?url=http%3A%2F%2Fpt.dhgate.com%2Fproduct%2Fwholesale-new-2016-women-and-man-little-bear%2F377403037.html	http://www.tqlkg.com/image-7893798-12274193	http://image.dhgate.com/600x600/f2/albu/g4/M01/D7/B3/rBVaEVb1XI6ANRgiAADgY9EQVDs939.jpg	Bracelete																yes			
DHGate	http://www.dhgate.com/	Portuguese Product Catalog	2016-06-16 00:55:31.791	SELOS MECÂNICOS MG1-50 (COM ASSENTO G4) TC / TC / NBR (LEFT primavera)		MG1-50 Mterial: carboneto de tungstênio, carboneto de tungstênio, viton G-4 304, a primavera é ESQUERDA DA PRIMAVERA	379507695					USD		54.05			http://www.dpbolvw.net/click-7893798-12274193?url=http%3A%2F%2Fpt.dhgate.com%2Fproduct%2Fmechanical-seals-mg1-50-with-g4-seat-tc-tc%2F379507695.html	http://www.tqlkg.com/image-7893798-12274193	http://image.dhgate.com/600x600/f2/albu/g1/M00/14/F5/rBVaGFbIE3mAfO8qAADa7oy4gjE001.jpg	OutrasPeçasdeReposição																yes			
DHGate	http://www.dhgate.com/	Portuguese Product Catalog	2016-06-16 00:55:31.791	9H à prova de explosão real de tela premium de vidro temperado protector Film para o iphone 4s 5s 6s Além disso Blackberry Z10 30 3 Q20 10 5 MOQ: 10pcs		9H à prova de explosão real de tela premium de vidro temperado protector Film para o iphone 4s 5s 6s Além disso Blackberry Z10 30 3 Q20 10 5 MOQ: 10pcs	229337658					USD		6			http://www.kqzyfj.com/click-7893798-12274193?url=http%3A%2F%2Fpt.dhgate.com%2Fproduct%2F0-4mm-for-iphone-5-premium-tempered-glass%2F229337658.html	http://www.tqlkg.com/image-7893798-12274193	http://image.dhgate.com/600x600/f2/albu/g4/M00/1C/DF/rBVaEVcwNu-Aa-ykAAXrHD-1hTo968.jpg	Protetoresdeteladecelular																yes			
DHGate	http://www.dhgate.com/	Portuguese Product Catalog	2016-06-16 00:55:31.792	2015 novo em stock DRS rolo do derma 540 agulhas, DRS rolo dermaroller microagulhas para a remoção de acne		Boa qualidade preço de fábrica de presente de Natal NOVA vendas Hot Best seller Atacado melhor melhor presente de qualidade em stock rolo do derma 540 agulhas	246638440					USD		41.2			http://www.tkqlhce.com/click-7893798-12274193?url=http%3A%2F%2Fpt.dhgate.com%2Fproduct%2F2015-new-in-stock-drs-540-needle-derma-roller%2F246638440.html	http://www.tqlkg.com/image-7893798-12274193	http://image.dhgate.com/albu_1074587387_00/1.600x600.jpg	Conjuntos&estojos																yes			
DHGate	http://www.dhgate.com/	Portuguese Product Catalog	2016-06-16 00:55:31.792	Fábrica Outlet- 2016 nova corrida futebol masculino 82 Jason Witten tamanho 88 Dez Bryant Cor do Rush limitada Elite Jersey S M L XL XXL XXXL		Encontrar Mais America Football Jerseys Informação sobre 2.016 novos homens # 039; s do Rush futebol 82 Jason Witten 88 tamanho Dez Bryant Cor do Rush limitada Elite Jersey SML XL XXL XXXL, alta qualidade modelador jersey, China jérseis de futebol mulheres fornecedores, camisa de futebol barato personalizado de camisola barata por atacado no Aliexpress.com	372782569					USD		24.92			http://www.tkqlhce.com/click-7893798-12274193?url=http%3A%2F%2Fpt.dhgate.com%2Fproduct%2Ffactory-outlet-2016-new-men-039-s-football%2F372782569.html	http://www.tqlkg.com/image-7893798-12274193	http://image.dhgate.com/600x600/f2/albu/g2/M00/13/91/rBVaGlaeLnGAYghsAADV6lL_H04798.jpg	CamisasdeFutebol																yes			
DHGate	http://www.dhgate.com/	Portuguese Product Catalog	2016-06-16 00:55:31.792	Chegada Nova Jersey Table Tennis / Badminton Roupa Ténis de Mesa Jersey Men Sports T-shirt Roupa do estilo do verão / Jersey frete grátis		Marca: Butterfly Tecido: poliéster (respirável tecido de secagem rápida) metragem: Homens # 039; s M-4XL, modelos femininos M-3XL	380243884					USD		13.83			http://www.tkqlhce.com/click-7893798-12274193?url=http%3A%2F%2Fpt.dhgate.com%2Fproduct%2Fnew-arrival-table-tennis-jersey-badminton%2F380243884.html	http://www.tqlkg.com/image-7893798-12274193	http://image.dhgate.com/600x600/f2/albu/g4/M00/67/45/rBVaEVcZ5aeAPjNrAABL-U2zAfs246.jpg	CamisetasBadminton																yes			
DHGate	http://www.dhgate.com/	Portuguese Product Catalog	2016-06-16 00:55:31.793	O Envio gratuito de Alto brilho DRL Olho de Águia luzes Diurnas de LED de Carro Luzes de trabalho de Origem Impermeável Estacionamento lâmpada		Com Luz de LED de Carro Luzes de trabalho de Origem	249481594					USD		1.64			http://www.tkqlhce.com/click-7893798-12274193?url=http%3A%2F%2Fpt.dhgate.com%2Fproduct%2Fhigh-brightness-drl-eagle-eye-daytime-running%2F249481594.html	http://www.tqlkg.com/image-7893798-12274193	http://image.dhgate.com/600x600/f2/albu/g2/M01/AF/85/rBVaGlYX_HSAId8HAAPD8lCfWo4889.jpg	LEDdiurno																yes			
DHGate	http://www.dhgate.com/	Portuguese Product Catalog	2016-06-16 00:55:31.793	2 set jogo cartão de jogo / Lot plástico de Texas Holdem poker cards Star Poker polonês jogos à prova d'água e maçantes zakka Tabuleiro		Jogo barato placa gráfica, Compro tabuleiro de jogo cartão de qualidade diretamente da China cartão SSD Fornecedores: Qualidade, garantia de qualidade, estamos ansiosos para suas ordens!	265768709					USD		8.69			http://www.kqzyfj.com/click-7893798-12274193?url=http%3A%2F%2Fpt.dhgate.com%2Fproduct%2F2-set-lot-plastic-playing-card-game-texas%2F265768709.html	http://www.tqlkg.com/image-7893798-12274193	http://image.dhgate.com/600x600/f2/albu/g1/M01/E1/15/rBVaGFZJKAOAZHNKAAIdHZC6dLc518.jpg	JogosdeCartas																yes			
DHGate	http://www.dhgate.com/	Portuguese Product Catalog	2016-06-16 00:55:31.793	2015 Nike Air Force 1 Homens Mulheres Sports Skateboarding barato branco Nike Air Force One sapatos tamanho 36-46 qualidade Original frete grátis		Colur: muitas cores diferentes que você pode choees. Tamanho: Nós geralmente tem tamanho US6.5 - US11, nosso produto de qualidade garantida, por favor, descansar compra garantida,% 100 barato e de alta qualidade.	376092719					USD		55.07			http://www.tkqlhce.com/click-7893798-12274193?url=http%3A%2F%2Fpt.dhgate.com%2Fproduct%2F2015-nike-air-force-1-men-women-sports-skateboarding%2F376092719.html	http://www.tqlkg.com/image-7893798-12274193	http://image.dhgate.com/600x600/f2/albu/g2/M01/EA/97/rBVaGlbmLQOACMqpAAGgBOdWmBw842.jpg	Calçadodecorrida																yes			
